ID,location,name,review,subject,time
2017_3_16_13_40_38_874043_61,,Meghna D,We are at this Hotel now and didn't want to wait to write our recommendations. Lovely clean hotel smack dab in the middle of everything. Very friendly and helpful staff. Nothing is ever a bother. Always have great suggestions and recommendations. We will most definitely be back and I would highly recommend it!!,Friendly clean hotel in a great location,Reviewed 1 May 2015 
2017_3_16_13_40_40_37826_62,"Gold Coast, Australia",Petrod42,"Great hotel, situated within walking distance of the Blue Mosque, Topiki Palace and Hagia Sophia, and about 15 mins walking to the Grand Bazaar or the piers for the boats at Galata bridge. .
Hotel is very clean and all staff very helpful and friendly. Free airport shuttle pick up if staying for 3 days or more. Breakfast served daily...",Great Hotel and incredible location,Reviewed 29 April 2015 
2017_3_16_13_40_41_191249_63,"Dallas, Texas",MaryAnn J,Fantastic stay. This is a very pretty hotel with a very calm feel amidst all the hustle and bustle in the area (it is very centrally located to most all the wonderful places to see and visit). The hotel offered several little perks to make the visit easier and more memorable. The breakfast was tasty with lots of variety. And...,Just wonderful -- very pretty hotel with a very friendly staff,Reviewed 27 April 2015 
2017_3_16_13_40_42_460349_64,"Zionsville, Indiana",Karen M,"Having been to Istanbul several times and staying in the boutique type hotels in Sultanahmet, we especially enjoyed our stay at the White House Hotel. The staff was more than accommodating and the hotel room was lovely.. Upon arriving and having been taken to our room, we found it lit with beautiful candles and rose petals were on the bed....",A Wonderful Night at the White House,Reviewed 24 April 2015 
2017_3_16_13_40_44_562058_65,"New Smyrna Beach, Florida",Apples64,The White House Hotel in Old Town Istanbul is a perfect home-away-from-home for visiting all the popular sites in this fabulous city. Its location is superior. You can walk everywhere from the Blue Mosque to cozy nearby cafes and unique shops. My husband and I stayed in this elegant yet comfortable boutique hotel recently for three nights. The staff was...,Fabulous Boutique Hotel,Reviewed 23 April 2015 
2017_3_16_13_40_45_725203_66,Republic of Macedonia,katenaum,"We have been looking at this hotel for the past 2 years, but it was constantly overbooked so we were not able to book a room. Finally, during our last visit to Istanbul, we were able to find 2 rooms. The welcoming was wonderful, with locum and juice at the reception, the breakfast was rich and delicious, the rooms very...","Fabulous hotel, great location, friendly staff",Reviewed 23 April 2015 
2017_3_16_13_40_46_963449_67,"London, United Kingdom",Jenao,"Lovely hotel and fantastic friendly, helpful staff. They upgraded us to a superior room for our 3 night stay on arrival and it was large and extremely comfortable. A really brilliant place to stay, right in the heart of the old city so could walk to all the main sights. Reception staff advised on best hamam, made bookings, gave directions,...",Fabulous hotel just a few minutes walk from main sights,Reviewed 23 April 2015 
2017_3_16_13_40_48_663964_68,"Boston, Massachusetts",JoAnn S,"My husband and I spent 4 days at the White House Hotel and we were incredibly impressed with the dedication of the the entire staff to service. From the minute we walked in until our last steps out the door, the staff was eager to help, answer questions and provide whatever we needed. The location was perfect, the breakfast delicious...",Great place to stay in old city Istanbul,Reviewed 21 April 2015 
2017_3_16_13_40_49_864244_69,"Palo Alto, California, United States",Ruchi G,"I was in Turkey by myself with two kids and was a bit scared as this was my first time traveling alone. The staff went out of the way to make my stay comfortable, took care of the trips I wanted to do, and even upgraded our room to make us comfortable. We had a wonderful stay.
The location is...","Great location, great decor, and super helpful and friendly staff,",Reviewed 20 April 2015 
2017_3_16_13_40_51_260130_70,"Boras, Sweden",Mikael L L,"Very nice hotel, with a very good location, close to the major attractions.
Very helpful staff, such as Negati and Ugur and the rest on the White House.
If you stay more than 3 nights you get an airporttransfer for free, wich is very nice.
I will stay here the next time again and recommend it to my friends.",Perfect hotel and location,Reviewed 20 April 2015 
2017_3_16_13_40_52_413216_71,,MarKayla J,We wrapped up our hotel visit today. The hotel is in the perfect location. It's near amazing restaurants and many tourist attractions. The hotel staff is what I loved most. They were very friendly and professional. I got a homely vibe from the staff and other guests. They served breakfast and it was a good selection. I was actually pretty...,Excellent Hotel!,Reviewed 30 November 2014 
2017_3_16_13_40_53_614271_72,"Canberra, Australia",Angus B,"The White House Istanbul is the ideal location for all travellers. It's location cannot be beaten, situated close to all the sites of the old city, though tucked away in a quiet street where noise isn't an issue. It is a safe secure venue, beautifully kept, clean, all the things you could want. The staff at the White House Istanbul...",Outstanding accomodation in the heart of Sultanahmet,Reviewed 29 November 2014 
2017_3_16_13_40_54_767803_73,,Douglas G,"We stayed in this lovely hotel for a couple of nights at the end of a bus tour in October.
We were greeted with refreshments upon check-in, assisted with directions, bags and where to shop.
Hotel staff made arrangements for pick up to the airport.
The hotel is in a fantastic area for exploring the old city area.
The room...",Excellent Experience,Reviewed 29 November 2014 
2017_3_16_13_40_55_899652_74,"Boston, Massachusetts",azzurri4ever,"As nice as the hotel is, with its optimal location and all, it is the staff that sets this hotel apart from all others. All of the great things said by the other reviewers are, of course, true, but none of these could occur without the dedication of a professional and caring staff. For us it started at the airport...",What a great staff!!!,Reviewed 29 November 2014 
2017_3_16_13_40_57_47566_75,"Singapore, Singapore",Jolyn23,This is an overdue review. I stayed in this hotel in February 2013. The airline lost my baggage on my way from Amsterdam to Istanbul.The friendly hotel staff were all very helpful in helping me to check on the status of my lost baggage by calling the airport throughout my 4 days there. They even made notes for the next...,Excellent Service,Reviewed 28 November 2014 
2017_3_16_13_41_0_347991_76,Oslo,PGF_Oslo,We were two couples visiting Istanbul for the first time. The great service we were offered started already at the Airport where the hotel pick-up service provided us with effective transportation to the hotel. The hotel staff received us with great hospitality and personal service. I have stayed in many hotels over the years but cannot really remember anywhere else...,Most enjoyable stay,Reviewed 25 November 2014 
2017_3_16_13_41_1_747408_77,,ID576207,"Very helpful attentive service, and the location cannot be beaten.
Room extremely clean, well cared for, excellent wifi signals, spacious and comfortable.
Breakfasts were filling and enjoyable, and the dining room enjoys splendid views of Haghia Sophia.
We were also given excellent restaurant recommendations on both of the two nights were there, which were much appreciated.
Strongly suggest using the...","Great hotel, right in the heart of Sultanahmet",Reviewed 25 November 2014 
2017_3_16_13_41_2_931242_78,"Bedzin, Poland",Pawel K,"Great hotel with perfect location in the heart of Istanbul.
Great staff in every way. Staff to read your mind and immediately realized your dreams and desires. I never encountered anything like this, and I travel a lot.
Highly reccommend White House Hotel.
If in the future I will be in Istanbul, surely will be at the White House Hotel.",White House Hotel Istanbul = Excellent Ideal Perfect,Reviewed 24 November 2014 
2017_3_16_13_41_4_131793_79,,therapia,As a group of four guests we had the chance to enjoy this small hotel in best location. Staff was amazingly friendly and gave us personal service at any time. The birthday surprise was just one of the extras we got! Thank you and see you in Istanbul!,Personal service,Reviewed 24 November 2014 
2017_3_16_13_41_5_269031_80,"Brno, Czech Republic",718mirka,"Excelent place in heart of Istambul, very friendly staff, manager of hotel Harun, who is anytime ready to help you with anything, excelent invitation, excelent services all the time, excelent brakfast with excelent view to Aya Sofia. We felt lika VIP guests :-)",Excelent,Reviewed 20 November 2014 
2017_3_16_13_41_6_500338_81,"??, ????",aquie,"I have been here a night on my honeymoon.
This is my second time at Istanbul, so I have other 2 hotels experience.
One is like dormitory guest house, the other is 4~5 star grade hotel.
This hotel doesn't have many rooms, thus it doesn't have 4 or 5 star grade.
However this hotel's service mind and cleanliness are great,...",Very good hotel at Old city(Sultanahmet),Reviewed 24 September 2014 
2017_3_16_13_41_7_732271_82,"Chicago, Illinois",Kenneth N,Our first trip to Istanbul and this hotel turned out to be as well located in the Old City as possible - walk to everything. We were there in late September with great weather and probably not as crowed as earlier. The staff were extremely helpful and courteous- all front dest staff fluent in English. This is a four star...,"Location, Location, Loction",Reviewed 23 September 2014 
2017_3_16_13_41_9_100908_83,"Auckland Region, New Zealand",NickLanigan,"We absolutely loved our stay at the White House.
We had a Superior Double Room, which was beautifully presented upon our arrival.
We took advantage of the free airport shuttle offer for stays 3 nights or longer - this was a great service after two long haul flights with a 5am arrival.
The roof top breakfast buffet was great -...",Absolutely perfect stay,Reviewed 23 September 2014 
2017_3_16_13_41_10_369836_84,"Columbus, Ohio",AW51,"This was our first visit to Istanbul. We found this property on Trip Advisor and, as is usually the case, we weren't steered wrong. A little place in the heart of the Old City. Excellent, helpful staff. Nice rooftop terrace for breakfast and BYO drinks at night. Within walking distance of major attractions. You know you are in Istanbul. And,...",Feel immersed in the Old City....,Reviewed 21 September 2014 
2017_3_16_13_41_11_833734_85,"Veracruz, Mexico",Aitor V,"White House Hotel is an excellent option if you want to stay (very) near the Old Town Attractions.
Locacation is perfect. Just a couple of hundred yards away from Hagia Sophia and the Blue Mosque but more importantly, it is steps away from the tram you will be using to move around the more common sights in Istanbul.
The hotel...",Great place to stay at the Old Town but a bit pricy for the value delivered,Reviewed 20 September 2014 
2017_3_16_13_41_13_433819_86,"Terrigal, Australia",Sandy897,"We stayed at this hotel on 2 occasions on our recent trip to Turkey
Each time the staff were very welcoming as all the reviews have stated, you really can't fault them. We really enjoyed the location as well as it is a very easy walk to all the attractions which is very handy in this very busy city.
Even...",Easy walk to everything!,Reviewed 20 September 2014 
2017_3_16_13_41_14_671042_87,,James H,"That title may seem to be an exaggeration, but if you choose to stay in the White House Hotel you will know that it is not. From the moment you arrived at the Hotel the staff roll out the red carpet for you. Dressed in finery, the staff greet you at the door with drinks and Turkish Delight. No standing,...","For as long as you are here, you are the Sultan!",Reviewed 18 September 2014 
2017_3_16_13_41_15_773664_88,"Belfast, United Kingdom",Owen1973,"At the end of a wonderful week staying in the White House Hotel, Istanbul, I must say that it was a wonderful experience. Omar, who greeted us at reception, together with the rest of the staff were exceptional in terms of their friendliness and hospitality. The room was spotlessly clean and beautifully decorated. The breakfast was lavish and the location...",Excellent in every way!,Reviewed 18 September 2014 
2017_3_16_13_41_17_6145_89,"Harrogate, United Kingdom",sew69,"The staff were extremely accommodating, helpful, and friendly, making sure my every need was met. They offered free beverages and snacks and made sure I was completely taken care of. The hotel itself is in the perfect location, within an easy walk to all of the most famous sights. The wi-fi was amazing, probably the best I've ever experienced in...",Excellent Hotel and Location,Reviewed 18 September 2014 
2017_3_16_13_41_18_206423_90,Wisconsin,JeanM55,"The White House Hotel in Istanbul is a charming hotel in an exceptional location for sightseeing. The service is excellent and the room we had was pleasant , though extremely elaborately decorated.
There are several restaurants immediately around the corner and almost everything you need or want to see is within easy walking distance. But the bathroom, at least in...",Great location--tiny bathroom,Reviewed 17 September 2014 
2017_3_16_13_41_19_653803_91,"Makati, Philippines",Frida A,"We stayed 3 nights in June 2014, tourist season was peaking and the weather was pleasantly warm.
mr. Cadirci the hotel owner stayed in touch with us every step of the way after we confirmed our reservations online. He arranged for free one way hotel transfer from the airport as part of our package. Our congratulations to you. You and...",A gem of a hotel in the middle of old Istanbul,Reviewed 20 June 2014 
2017_3_16_13_41_20_855206_92,"Madrid, Spain",Rafael M,"We stayed just one night in The White House Hotel, but it was time enough to become our favourite hotel in Istanbul. It is very closed to Sultan Hamet square and therefore, to most of the important monuments in Istanbul. The rooms are not very big but really comfortable. The breakfast is served in a terrace in the roof. It...",The hotel to be in Istanbul,Reviewed 18 June 2014 
2017_3_16_13_41_22_93101_93,"London, United Kingdom",Chalky2014,I stayed here with a friend and we both thought the hotel superb. The staff were particularly friendly and helpful and English speaking. The rooms clean although perhaps a little small. The location of the hotel couldn't be better being situated in the Sultanahmet area of Istanbul near a lot of the best historical sights. There are also lots of...,Istanbul Gem,Reviewed 16 June 2014 
2017_3_16_13_41_23_278537_94,"Singapore, Singapore",Lee2013_Singapore,"Hotel excelled in the personal touch. From a thoughtful bottle of wine left for you in the room, to a box of turkish delight and flowers when you depart, it was the little touches that made the visit memorable.
The rooms were nice, clean and functional with very good shower facilities. Overall a lovely stay!",lovely boutique hotel,Reviewed 16 June 2014 
2017_3_16_13_41_25_743415_95,"Oslo, Norway",Anne K,Small hotel with a nice roof terrasse. Excellent location for the historical sites and the Basar. Very friendly and helpful staff. Small rooms but very clean. The breakfast at roof terrasse was a pleasant way to strat the day in a hectic city.,An excellent hotel when viting Istanbul,Reviewed 16 June 2014 
2017_3_16_13_41_27_397335_96,Winterthur,Ginger1Winterthur,"We did enjoy very much our stay in this hotel. The location in Sultanahmet is close to the main historical sites. Also close by is a great selection of excellent restaurants with local food. The room and the bathroom was clean and well organised. Unfortunately the views from our room was not great, just a couple of meters away from...","Great location and helpful staff, but quite noisy",Reviewed 15 June 2014 
2017_3_16_13_41_28_597791_97,"Johannesburg, South Africa",hervecoenen,"We stayed at this hotel for three nights at the end of May 2014. The hotel is superbly central in the Istanbul's historic centre of Sultanahmet. Major sites like the Hagia Sophia, the Blue Mosque, Topkapi Palace, the Grand Bazaar and other sites are within 10' to 15' walk. Most of them you can see from the roof terrace.
The...",AN EXCELLENT BOUTIQUE HOTEL,Reviewed 15 June 2014 
2017_3_16_13_41_29_744869_98,"New York City, New York",GL_from_NYC,"This hotel was recommended by a friend who stayed here a few months ago. The hotel itself is just right for what it is: a boutique hotel in the old city, very close to some of Istanbul's major attractions.
First, the room and the hotel were clean. The bathroom pretty much sparkled, with attention paid to the design and to...",Just right,Reviewed 15 June 2014 
2017_3_16_13_41_30_946487_99,London,floramalone,"Have stayed here a couple of times for work as location relatively convenient. Staff very friendly and helpful; location good, although the street both times has been very noisy early in the morning, despite good air conditioning in the hotel. It is a visual feast of reproduction gilt and cream everywhere - doors, beds, ceilings, etc. - completely over the...",Overrated,Reviewed 14 June 2014 
2017_3_16_13_41_32_262876_100,"Vancouver, Canada",Kathy B,"This is a charming hotel with absolutely fantastic staff, some of the best I have ever run into and I travel a lot. The rooms are small but well appointed and comfortable. The location is fantastic, can't be beat. Although in a busy tourist are the rooms were quiet. The roof top restaurant was fantastic, over looking the Hagia Sophia...",Excellent small hotel,Reviewed 13 June 2014 
